{
  "$schema": "http://json-schema.org/draft-07/schema#",
  "type": "object",
  "required": ["id","version","title","meter","difficulty","encoding","s1","s2","created_at"],
  "definitions": {
    "translationRights": {
      "type": "object",
      "description": "Per-language publication-rights status for a translation text.",
      "properties": {
        "rights_holder":  { "type": "string", "description": "Copyright owner (author/estate/publisher); 'public domain' if expired" },
        "source":         { "type": "string", "description": "Bibliographic citation of the translation source" },
        "license":        { "type": "string", "description": "Agreement number (SK-LIC-YYYY-NNN), SPDX id, or 'public-domain'" },
        "permission_ref": { "type": "string", "description": "Agreement reference, e.g. SK-LIC-2026-002/SEM-2026-001" },
        "attribution":    { "type": "string", "description": "Ready-to-print credit line for captions/manifests, e.g. 'пер. с санскрита: Sanskrit Karaoke, 2026 · по Бётлингку, Indische Sprüche №550'; overrides the tool defaults" },
        "status":         { "type": "string", "enum": ["public-domain","own-work","cleared","license-pending","unknown"],
                            "description": "Publication clearance — only public-domain/own-work/cleared may be published" }
      }
    }
  },
  "properties": {
    "id":         { "type": "string", "pattern": "^[a-z0-9_]+$",
                    "description": "Slug, e.g. bhg_2_47" },
    "version":    { "type": "integer", "minimum": 1 },
    "title": {
      "type": "object",
      "properties": {
        "ru": { "type": "string" },
        "en": { "type": "string" }
      },
      "required": ["ru"]
    },
    "source": {
      "type": "object",
      "properties": {
        "text":    { "type": "string", "description": "Scripture / collection name, e.g. Bhagavad Gita, Indische Sprüche (Böhtlingk)" },
        "chapter": { "type": "integer" },
        "verse":   { "type": "integer" },
        "attribution": { "type": "string",
                         "description": "Original-source citation as recorded by the collector, e.g. 'Böhtlingk, Indische Sprüche №1249; Pañcatantra / Hitopadeśa'" }
      }
    },
    "meter":      { "type": "string", "description": "e.g. anushtubh, indravajra, mandakranta" },
    "difficulty": { "type": "integer", "minimum": 1, "maximum": 5,
                    "description": "1=beginner … 5=advanced" },
    "language_tags": { "type": "array", "items": { "type": "string", "enum": ["ru","en","de"] } },
    "author": {
      "type": "object",
      "properties": {
        "melody":         { "type": "string" },
        "transcription":  { "type": "string" }
      }
    },
    "encoding": { "type": "string", "enum": ["DEV","IAST","SLP1","HK","ITRANS","VH","WX"] },
    "s1":    { "type": "string", "description": "First half-verse input text" },
    "s2":    { "type": "string", "description": "Second half-verse input text" },
    "s1dev": { "type": "string", "description": "Devanagari for s1 (optional if encoding=DEV)" },
    "s2dev": { "type": "string", "description": "Devanagari for s2" },
    "translation": {
      "type": "object",
      "properties": {
        "ru": { "type": "string" },
        "en": { "type": "string" },
        "de": { "type": "string", "description": "German translation/gloss, e.g. Böhtlingk's rendering in Indische Sprüche" },
        "provenance": {
          "type": "object",
          "description": "Who produced each translation — machine output must be marked (DH norm)",
          "properties": {
            "ru": { "type": "string", "enum": ["human", "human-reviewed", "gemini-flash", "claude", "public-domain", "licensed", "unknown"] },
            "en": { "type": "string", "enum": ["human", "human-reviewed", "gemini-flash", "claude", "public-domain", "licensed", "unknown"] },
            "de": { "type": "string", "enum": ["human", "human-reviewed", "gemini-flash", "claude", "public-domain", "licensed", "unknown"] }
          }
        },
        "rights": {
          "type": "object",
          "description": "Per-language publication-rights status for the translation text.",
          "properties": {
            "ru": { "$ref": "#/definitions/translationRights" },
            "en": { "$ref": "#/definitions/translationRights" },
            "de": { "$ref": "#/definitions/translationRights" }
          }
        }
      }
    },
    "audio": {
      "type": "object",
      "required": ["rights_holder", "license", "permission_ref"],
      "properties": {
        "drive_file_id": { "type": "string" },
        "duration_s":    { "type": ["number", "null"],
                           "description": "Actual recording duration in seconds; null when audio is not yet uploaded" },
        "rights_holder": { "type": "string",
                           "description": "Performer / copyright owner of the recording, e.g. Usha Sanka" },
        "license":       { "type": "string",
                           "description": "Agreement number (SK-LIC-YYYY-NNN) or SPDX id (e.g. CC-BY-4.0)" },
        "permission_ref": { "type": "string",
                            "pattern": "^[A-Z]{2,5}-[A-Z]{2,5}-[0-9]{4}-[0-9]{3}(/[A-Z]{2,5}-[0-9]{4}-[0-9]{3})?$",
                            "description": "Agreement/recording reference, e.g. SK-LIC-2026-001/USK-2026-001 (Annex A Recording ID)" },
        "sha256":        { "type": "string", "pattern": "^[0-9a-f]{64}$",
                           "description": "Checksum of the canonical audio file (FAIR integrity)" },
        "canonical_url": { "type": "string", "format": "uri",
                           "description": "Stable public URL of the canonical audio; Drive is only a working copy" }
      }
    },
    "session": {
      "type": "object",
      "description": "Saved app session (timing, positions) hosted on Drive",
      "properties": {
        "drive_file_id": { "type": "string" },
        "created_at":    { "type": "string", "format": "date" }
      }
    },
    "timing": {
      "type": "object",
      "description": "Per-syllable timestamps exported from the Timing Editor",
      "properties": {
        "s1": { "type": "array", "items": { "type": "number" } },
        "s2": { "type": "array", "items": { "type": "number" } },
        "confidence": {
          "type": "object",
          "properties": {
            "s1": { "type": "array", "items": { "type": "number", "minimum": 0, "maximum": 1 } },
            "s2": { "type": "array", "items": { "type": "number", "minimum": 0, "maximum": 1 } }
          }
        },
        "auto_generated": { "type": "boolean" },
        "generator": { "type": "string", "description": "browser-v1 | whisper-v1 | manual" }
      }
    },
    "glosses": {
      "type": "array",
      "description": "Per-word gloss layer, word-aligned to the verse. Two sources, baked in by tools/build_glosses.py — generated, not hand-authored: (a) gita-gold-master hand-curated glosses+morphology for Gita verses (H4734), (b) the Sa→Ru corpus_lexicon machine word-alignment (SanskritLexicography/RussianTranslation).",
      "items": {
        "type": "object",
        "required": ["ru"],
        "properties": {
          "slp1":     { "type": "string", "description": "SLP1 word/lemma key as aligned in the corpus (corpus-align source only)" },
          "sa":       { "type": "string", "description": "IAST form of the word" },
          "ru":       { "type": "string", "description": "Russian gloss for this word" },
          "gloss_en": { "type": "string", "description": "English gloss (gita-gold-master source)" },
          "dev":      { "type": "string", "description": "Devanagari form (gita-gold-master source)" },
          "lemma":    { "type": "string", "description": "Lemma, e.g. √bhū or karma-phala-hetu (gita-gold-master source)" },
          "morph":    {
            "type": "object",
            "description": "Morphology columns from the gita-gold-master, verbatim (empty values dropped)",
            "properties": {
              "form_type": { "type": "string" },
              "code":      { "type": "string" },
              "tense":     { "type": "string" },
              "pada":      { "type": "string" },
              "vclass":    { "type": "string" },
              "root":      { "type": "string" },
              "root_tr":   { "type": "string" },
              "prefix":    { "type": "string" },
              "stem_end":  { "type": "string" },
              "gender":    { "type": "string" },
              "compound":  { "type": "string" },
              "mark":      { "type": "string" },
              "rule":      { "type": "string" }
            }
          }
        }
      }
    },
    "gloss_source": {
      "type": "object",
      "description": "Provenance of the glosses layer (DH norm: machine-aligned output is marked).",
      "properties": {
        "corpus":     { "type": "string", "description": "Source asset, e.g. SanskritLexicography/RussianTranslation/src/corpus_lexicon.jsonl or kosha/data/gita/gita_gold_master.tsv" },
        "work":       { "type": "string", "description": "Corpus work id the glosses were drawn from, e.g. bhagavadgita-sementsov or gita-gold-master" },
        "passage":    { "type": "string", "description": "Corpus passage key, e.g. 2.47" },
        "provenance": { "type": "string", "enum": ["corpus-align", "gita-gold-hand-curated", "human", "human-reviewed", "unknown"],
                        "description": "corpus-align = machine word-alignment over a translation; gita-gold-hand-curated = hand-curated Gita gold master (kosha gita-gold-master)" },
        "rights_note":{ "type": "string", "description": "Rights context inherited from the source translation" }
      }
    },
    "tags":       { "type": "array", "items": { "type": "string" } },
    "created_at": { "type": "string", "format": "date" },
    "updated_at": { "type": "string", "format": "date" }
  }
}
