{
  "id": "bhg_2_49",
  "version": 2,
  "title": {
    "ru": "Бхагавад-гита 2.49",
    "en": "Bhagavad Gita 2.49"
  },
  "source": {
    "text": "Bhagavad Gita",
    "chapter": 2,
    "verse": 49
  },
  "meter": "anushtubh",
  "difficulty": 2,
  "language_tags": [
    "ru",
    "en"
  ],
  "author": {
    "melody": "Уша Санка",
    "transcription": "Mārcis Gasūns"
  },
  "encoding": "DEV",
  "s1": "दूरेण ह्यवरं कर्म बुद्धियोगाद्धनञ्जय।",
  "s2": "बुद्धौ शरणमन्विच्छ कृपणाः फलहेतवः॥",
  "s1dev": "दूरेण ह्यवरं कर्म बुद्धियोगाद्धनञ्जय।",
  "s2dev": "बुद्धौ शरणमन्विच्छ कृपणाः फलहेतवः॥",
  "translation": {
    "ru": "Воистину, действие намного ниже йоги разума, о Дхананджая.",
    "en": "Action, O Dhanañjaya! is far inferior to the devotion of the mind. In that devotion seek shelter. Wretched are those whose motive (to action) is the fruit (of action).",
    "provenance": {
      "ru": "licensed",
      "en": "public-domain"
    },
    "rights": {
      "ru": {
        "rights_holder": "V. S. Sementsov; translation copyright held by his daughter (heir)",
        "source": "Семенцов В. С., «Бхагавадгита в традиции и в современной научной критике», Москва: Наука, 1985",
        "license": "permission letter from the translator's daughter (heir); to be formalized as SK-LIC-2026-002",
        "permission_ref": "SK-LIC-2026-002/SEM-2026-003",
        "attribution": "по мотивам перевода В. С. Семенцова (переложение; не дословный текст перевода)",
        "status": "cleared"
      },
      "en": {
        "rights_holder": "public domain (K. T. Telang, d. 1893)",
        "source": "Telang, K. T., The Bhagavadgîtâ, Sacred Books of the East vol. 8, Oxford 1882",
        "license": "public-domain",
        "status": "public-domain"
      }
    }
  },
  "audio": {
    "drive_file_id": "TODO",
    "duration_s": null,
    "rights_holder": "Usha Sanka",
    "license": "SK-LIC-2026-001",
    "permission_ref": "SK-LIC-2026-001/USK-2026-003"
  },
  "session": {
    "drive_file_id": "TODO",
    "created_at": "2026-05-12"
  },
  "tags": [
    "bhagavad-gita",
    "intermediate"
  ],
  "created_at": "2026-05-12",
  "updated_at": "2026-08-26",
  "glosses": [
    {
      "sa": "dūreṇa",
      "ru": "далеко (отбрось)",
      "gloss_en": "by far",
      "lemma": "dūreṇa",
      "dev": "दूरेण​",
      "morph": {
        "tense": "av."
      }
    },
    {
      "sa": "hi",
      "ru": "безусловно",
      "gloss_en": "because, just, indeed, surely",
      "lemma": "hi",
      "dev": "हि",
      "morph": {
        "tense": "av.",
        "rule": "v7"
      }
    },
    {
      "sa": "avaram",
      "ru": "порочную",
      "gloss_en": "low, mean, younger, inferior",
      "lemma": "avara",
      "dev": "अवरम्",
      "morph": {
        "code": "1n.1 n.",
        "root": "√vṛ",
        "stem_end": "a",
        "gender": "n"
      }
    },
    {
      "sa": "karma",
      "ru": "деятельность",
      "gloss_en": "activity and its result",
      "lemma": "karman",
      "dev": "कर्म​",
      "morph": {
        "code": "1n.1 n.",
        "root": "√kṛ",
        "stem_end": "an",
        "gender": "n",
        "rule": "m"
      }
    },
    {
      "sa": "buddhi-yogād",
      "ru": "благодаря деятельности в сознании Кришны",
      "gloss_en": "than yoga evolved from intelligence",
      "lemma": "buddhi-yoga",
      "dev": "बुद्धियोगाद्",
      "morph": {
        "code": "5n.1 m.",
        "root": "√budh",
        "stem_end": "a",
        "gender": "m",
        "compound": "TP"
      }
    },
    {
      "sa": "dhanaṁjaya",
      "ru": "о завоеватель богатств",
      "gloss_en": "O winner of wealth, O Dhanaṁjaya",
      "lemma": "dhanaṁ-jaya",
      "dev": "धनञ्जय​",
      "morph": {
        "code": "8n.1 m.",
        "root": "√ji",
        "stem_end": "a",
        "gender": "m"
      }
    },
    {
      "sa": "buddhau",
      "ru": "в таком сознании",
      "gloss_en": "in intelligence, in thought, in understanding, in knowledge, in an idea",
      "lemma": "buddhi",
      "dev": "बुद्धौ",
      "morph": {
        "code": "7n.1 f.",
        "root": "√budh",
        "stem_end": "i",
        "gender": "f"
      }
    },
    {
      "sa": "śaraṇam",
      "ru": "к полной преданности",
      "gloss_en": "shelter, refuge, protection",
      "lemma": "śaraṇa",
      "dev": "शरणम्",
      "morph": {
        "code": "2n.1 n.",
        "root": "√śri",
        "stem_end": "a",
        "gender": "n"
      }
    },
    {
      "sa": "anviccha",
      "ru": "стремись",
      "gloss_en": "seek, desire",
      "lemma": "anu-√iṣ",
      "dev": "अन्विच्छ​",
      "morph": {
        "code": "2v.1",
        "tense": "Imperat. P",
        "root": "√iṣ"
      }
    },
    {
      "sa": "kṛpaṇāḥ",
      "ru": "скупцы",
      "gloss_en": "who are pitiable, miserable, poor",
      "lemma": "kṛpaṇa",
      "dev": "कृपणाः",
      "morph": {
        "code": "1n.3 m.",
        "root": "√kṛp",
        "stem_end": "a",
        "gender": "m"
      }
    },
    {
      "sa": "phala-hetavaḥ",
      "ru": "те, кто стремится к плодам своего труда.",
      "gloss_en": "who are the cause of the results",
      "lemma": "phala-hetu",
      "dev": "फलहेतवः",
      "morph": {
        "code": "1n.3 m.",
        "root": "√phal",
        "stem_end": "u",
        "gender": "m",
        "compound": "BV"
      }
    }
  ],
  "gloss_source": {
    "corpus": "kosha/data/gita/gita_gold_master.tsv",
    "work": "gita-gold-master",
    "passage": "2.49",
    "provenance": "gita-gold-hand-curated",
    "rights_note": "Word-level glosses + morphology from the hand-curated Gita gold master (Dr. Mārcis Gasūns, Gita.xlsm), distributed as kosha dataset gita-gold-master (CC BY-SA 4.0)."
  }
}
