{
  "id": "bhg_2_48",
  "version": 2,
  "title": {
    "ru": "Бхагавад-гита 2.48",
    "en": "Bhagavad Gita 2.48"
  },
  "source": {
    "text": "Bhagavad Gita",
    "chapter": 2,
    "verse": 48
  },
  "meter": "anushtubh",
  "difficulty": 1,
  "language_tags": [
    "ru",
    "en"
  ],
  "author": {
    "melody": "Уша Санка",
    "transcription": "Mārcis Gasūns"
  },
  "encoding": "DEV",
  "s1": "योगस्थः कुरु कर्माणि सङ्गं त्यक्त्वा धनञ्जय।",
  "s2": "सिद्ध्यसिद्ध्योः समो भूत्वा समत्वं योग उच्यते॥",
  "s1dev": "योगस्थः कुरु कर्माणि सङ्गं त्यक्त्वा धनञ्जय।",
  "s2dev": "सिद्ध्यसिद्ध्योः समो भूत्वा समत्वं योग उच्यते॥",
  "translation": {
    "ru": "Пребывая в йоге, совершай действия, оставив привязанность, о Дхананджая.",
    "en": "Having recourse to devotion, O Dhanañjaya! perform actions, casting off (all) attachment, and being equable in success or ill-success; (such) equability is called devotion.",
    "provenance": {
      "ru": "licensed",
      "en": "public-domain"
    },
    "rights": {
      "ru": {
        "rights_holder": "V. S. Sementsov; translation copyright held by his daughter (heir)",
        "source": "Семенцов В. С., «Бхагавадгита в традиции и в современной научной критике», Москва: Наука, 1985",
        "license": "permission letter from the translator's daughter (heir); to be formalized as SK-LIC-2026-002",
        "permission_ref": "SK-LIC-2026-002/SEM-2026-002",
        "attribution": "по мотивам перевода В. С. Семенцова (переложение; не дословный текст перевода)",
        "status": "cleared"
      },
      "en": {
        "rights_holder": "public domain (K. T. Telang, d. 1893)",
        "source": "Telang, K. T., The Bhagavadgîtâ, Sacred Books of the East vol. 8, Oxford 1882",
        "license": "public-domain",
        "status": "public-domain"
      }
    }
  },
  "audio": {
    "drive_file_id": "TODO",
    "duration_s": null,
    "rights_holder": "Usha Sanka",
    "license": "SK-LIC-2026-001",
    "permission_ref": "SK-LIC-2026-001/USK-2026-002"
  },
  "session": {
    "drive_file_id": "TODO",
    "created_at": "2026-05-12"
  },
  "tags": [
    "bhagavad-gita",
    "beginner"
  ],
  "created_at": "2026-05-12",
  "updated_at": "2026-08-26",
  "glosses": [
    {
      "sa": "yoga-sthaḥ",
      "ru": "уравновешенный",
      "gloss_en": "who stays in yoga",
      "lemma": "yoga-stha",
      "dev": "योगस्थः",
      "morph": {
        "code": "1n.1 m.",
        "root": "√yuj",
        "stem_end": "a",
        "gender": "m"
      }
    },
    {
      "sa": "kuru",
      "ru": "выполняй",
      "gloss_en": "do",
      "lemma": "√kṛ",
      "dev": "कुरु",
      "morph": {
        "code": "2v.1",
        "tense": "Imperat P",
        "root": "√kṛ"
      }
    },
    {
      "sa": "karmāṇi",
      "ru": "обязанности",
      "gloss_en": "activities",
      "lemma": "karman",
      "dev": "कर्माणि",
      "morph": {
        "code": "2n.3 n.",
        "root": "√kṛ",
        "stem_end": "an",
        "gender": "n"
      }
    },
    {
      "sa": "saṅgam",
      "ru": "привязанность",
      "gloss_en": "clinging, contact, relation, desire, attachment",
      "lemma": "saṅga",
      "dev": "सङ्गम्",
      "morph": {
        "code": "2n.1m.",
        "root": "√gam",
        "stem_end": "a",
        "gender": "m",
        "rule": "m"
      }
    },
    {
      "sa": "tyaktvā",
      "ru": "отвергнув",
      "gloss_en": "after abandoning",
      "lemma": "√tyaj",
      "dev": "त्यक्त्वा",
      "morph": {
        "tense": "absol.",
        "root": "√tyaj"
      }
    },
    {
      "sa": "dhanaṁjaya",
      "ru": "о Арджуна",
      "gloss_en": "O winner of wealth, O Dhanaṁjaya",
      "lemma": "dhanaṁ-jaya",
      "dev": "धनञ्जय​",
      "morph": {
        "code": "8n.1 m.",
        "root": "√ji",
        "stem_end": "a",
        "gender": "m"
      }
    },
    {
      "sa": "siddhy-asiddhyoḥ",
      "ru": "в успехе и неудаче",
      "gloss_en": "in success and failure",
      "lemma": "siddhy-asiddhi",
      "dev": "सिद्ध्यसिद्ध्योः",
      "morph": {
        "code": "7n.2 f.",
        "root": "√sidh",
        "stem_end": "i",
        "gender": "f"
      }
    },
    {
      "sa": "samaḥ",
      "ru": "уравновешенный",
      "gloss_en": "the same, equal, equivalent",
      "lemma": "sama",
      "dev": "समः",
      "morph": {
        "code": "1n.1 m.",
        "tense": "sn.",
        "stem_end": "a",
        "gender": "m",
        "rule": "h3"
      }
    },
    {
      "sa": "bhūtvā",
      "ru": "став",
      "gloss_en": "after becoming",
      "lemma": "√bhū",
      "dev": "भूत्वा",
      "morph": {
        "tense": "absol.",
        "root": "√bhū"
      }
    },
    {
      "sa": "samatvam",
      "ru": "самообладание",
      "gloss_en": "equality, tranquility",
      "lemma": "samatva",
      "dev": "समत्वम्",
      "morph": {
        "code": "1n.1 n.",
        "tense": "abst.",
        "stem_end": "a",
        "gender": "n",
        "rule": "m"
      }
    },
    {
      "sa": "yogaḥ",
      "ru": "йога",
      "gloss_en": "yoga, yoking, application, a means, one of the schools of Hindu philosophy",
      "lemma": "yoga",
      "dev": "योगः",
      "morph": {
        "code": "1n.1 m.",
        "root": "√yuj",
        "stem_end": "a",
        "gender": "m",
        "rule": "h1"
      }
    },
    {
      "sa": "ucyate",
      "ru": "называется.",
      "gloss_en": "it is said",
      "lemma": "√vac",
      "dev": "उच्यते",
      "morph": {
        "code": "1v.1",
        "tense": "Praes. pass.",
        "root": "√vac"
      }
    }
  ],
  "gloss_source": {
    "corpus": "kosha/data/gita/gita_gold_master.tsv",
    "work": "gita-gold-master",
    "passage": "2.48",
    "provenance": "gita-gold-hand-curated",
    "rights_note": "Word-level glosses + morphology from the hand-curated Gita gold master (Dr. Mārcis Gasūns, Gita.xlsm), distributed as kosha dataset gita-gold-master (CC BY-SA 4.0)."
  }
}
