{
  "id": "bhg_2_47",
  "version": 2,
  "title": {
    "ru": "Бхагавад-гита 2.47",
    "en": "Bhagavad Gita 2.47"
  },
  "source": {
    "text": "Bhagavad Gita",
    "chapter": 2,
    "verse": 47
  },
  "meter": "anushtubh",
  "difficulty": 1,
  "language_tags": [
    "ru",
    "en"
  ],
  "author": {
    "melody": "Уша Санка",
    "transcription": "Mārcis Gasūns"
  },
  "encoding": "DEV",
  "s1": "कर्मण्येवाधिकारस्ते मा फलेषु कदाचन।",
  "s2": "मा कर्मफलहेतुर्भूर्मा ते सङ्गोऽस्त्वकर्मणि॥",
  "s1dev": "कर्मण्येवाधिकारस्ते मा फलेषु कदाचन।",
  "s2dev": "मा कर्मफलहेतुर्भूर्मा ते सङ्गोऽस्त्वकर्मणि॥",
  "translation": {
    "ru": "Твое право лишь в действии, но не в его плодах.",
    "en": "Your business is with action alone; not by any means with fruit. Let not the fruit of action be your motive (to action). Let not your attachment be (fixed) on inaction.",
    "provenance": {
      "ru": "licensed",
      "en": "public-domain"
    },
    "rights": {
      "ru": {
        "rights_holder": "V. S. Sementsov; translation copyright held by his daughter (heir)",
        "source": "Семенцов В. С., «Бхагавадгита в традиции и в современной научной критике», Москва: Наука, 1985",
        "license": "permission letter from the translator's daughter (heir); to be formalized as SK-LIC-2026-002",
        "permission_ref": "SK-LIC-2026-002/SEM-2026-001",
        "attribution": "по мотивам перевода В. С. Семенцова (переложение; не дословный текст перевода)",
        "status": "cleared"
      },
      "en": {
        "rights_holder": "public domain (K. T. Telang, d. 1893)",
        "source": "Telang, K. T., The Bhagavadgîtâ, Sacred Books of the East vol. 8, Oxford 1882",
        "license": "public-domain",
        "status": "public-domain"
      }
    }
  },
  "audio": {
    "drive_file_id": "TODO",
    "duration_s": null,
    "rights_holder": "Usha Sanka",
    "license": "SK-LIC-2026-001",
    "permission_ref": "SK-LIC-2026-001/USK-2026-001"
  },
  "session": {
    "drive_file_id": "TODO",
    "created_at": "2026-05-12"
  },
  "tags": [
    "bhagavad-gita",
    "beginner"
  ],
  "created_at": "2026-05-12",
  "updated_at": "2026-08-26",
  "glosses": [
    {
      "sa": "karmaṇi",
      "ru": "в предписанных обязанностях",
      "gloss_en": "in activity",
      "lemma": "karman",
      "dev": "कर्मणि",
      "morph": {
        "code": "7n.1 n.",
        "root": "√kṛ",
        "stem_end": "an",
        "gender": "n",
        "rule": "v7"
      }
    },
    {
      "sa": "eva",
      "ru": "безусловно",
      "gloss_en": "certainly, just, merely",
      "lemma": "eva",
      "dev": "एव​",
      "morph": {
        "tense": "av.",
        "stem_end": "a",
        "rule": "v1"
      }
    },
    {
      "sa": "adhikāraḥ",
      "ru": "право",
      "gloss_en": "authority, right, privilege",
      "lemma": "adhikāra",
      "dev": "अधिकारः",
      "morph": {
        "code": "1n.1 m.",
        "root": "√kṛ",
        "stem_end": "a",
        "gender": "m",
        "rule": "h5"
      }
    },
    {
      "sa": "te",
      "ru": "тебя",
      "gloss_en": "your",
      "lemma": "yuṣmat",
      "dev": "ते",
      "morph": {
        "code": "6n.1",
        "tense": "sn.",
        "stem_end": "t"
      }
    },
    {
      "sa": "mā",
      "ru": "не",
      "gloss_en": "not!",
      "lemma": "mā",
      "dev": "मा",
      "morph": {
        "tense": "av."
      }
    },
    {
      "sa": "phaleṣu",
      "ru": "в плодах",
      "gloss_en": "in fruits, in results",
      "lemma": "phala",
      "dev": "फलेषु",
      "morph": {
        "code": "7n.3 n.",
        "root": "√phal",
        "stem_end": "a",
        "gender": "n"
      }
    },
    {
      "sa": "kadā-cana",
      "ru": "когда бы то ни было",
      "gloss_en": "whenever, at any time",
      "lemma": "kadā-cana",
      "dev": "कदाचन​",
      "morph": {
        "tense": "av.",
        "stem_end": "a"
      }
    },
    {
      "sa": "mā",
      "ru": "не",
      "gloss_en": "not!",
      "lemma": "mā",
      "dev": "मा",
      "morph": {
        "tense": "av."
      }
    },
    {
      "sa": "karma-phala-hetuḥ",
      "ru": "результатами деятельности-побуждаемый",
      "gloss_en": "whose work is a cause of results",
      "lemma": "karma-phala-hetu",
      "dev": "कर्मफलहेतुः",
      "morph": {
        "code": "1n.1 m.",
        "root": "√kṛ",
        "stem_end": "u",
        "gender": "m",
        "compound": "BV",
        "rule": "h4"
      }
    },
    {
      "sa": "bhūḥ",
      "ru": "будь",
      "gloss_en": "used with particle mā loses prefix ‘a-’ and makes the imperative: do not be!",
      "lemma": "√bhū",
      "dev": "भूः",
      "morph": {
        "code": "2v.1",
        "tense": "Aor. P",
        "root": "√bhū"
      }
    },
    {
      "sa": "mā",
      "ru": "не",
      "gloss_en": "not!",
      "lemma": "mā",
      "dev": "मा",
      "morph": {
        "tense": "av."
      }
    },
    {
      "sa": "te",
      "ru": "тебя",
      "gloss_en": "your",
      "lemma": "yuṣmat",
      "dev": "ते",
      "morph": {
        "code": "6n.1",
        "tense": "sn.",
        "stem_end": "t"
      }
    },
    {
      "sa": "saṅgaḥ",
      "ru": "привязанность",
      "gloss_en": "clinging, contact, relation, desire, attachment",
      "lemma": "saṅga",
      "dev": "सङ्गः",
      "morph": {
        "code": "1n.1m.",
        "root": "√gam",
        "stem_end": "a",
        "gender": "m",
        "rule": "h2"
      }
    },
    {
      "sa": "astu",
      "ru": "пусть будет",
      "gloss_en": "it should be",
      "lemma": "√as",
      "dev": "अस्तु",
      "morph": {
        "code": "1v.1",
        "tense": "Imperat. P",
        "root": "√as"
      }
    },
    {
      "sa": "akarmaṇi",
      "ru": "в отказе от выполнения своего долга.",
      "gloss_en": "in inactivity",
      "lemma": "a-karman",
      "dev": "अकर्मणि",
      "morph": {
        "code": "7n.1 n.",
        "root": "√kṛ",
        "stem_end": "an",
        "gender": "n"
      }
    }
  ],
  "gloss_source": {
    "corpus": "kosha/data/gita/gita_gold_master.tsv",
    "work": "gita-gold-master",
    "passage": "2.47",
    "provenance": "gita-gold-hand-curated",
    "rights_note": "Word-level glosses + morphology from the hand-curated Gita gold master (Dr. Mārcis Gasūns, Gita.xlsm), distributed as kosha dataset gita-gold-master (CC BY-SA 4.0)."
  }
}
